name,address,description,phone,website,image,city,state
Schulhof Property Management LLC,"825 North 16th Street, Milwaukee, WI 53233","Schulhof Property Management has been managing over 25 rental apartments for more than 30 years for the Marquette University Campus. They currently hold an A+ rating with the Better Business Bureau. Apartments available for students are studios, one bedr ...Read More",4149331211,https://schulhofproperties.com/,https://www.propertymanagement.com/wp-content/uploads/2022/05/Schulhof-Property-Management-LLC.jpg,Milwaukee,Wisconsin
Structure Properties,"225 East St. Paul Avenue, Suite 302, Milwaukee, WI 53202","Structure Properties is a self-proclaimed boutique firm stationed in Milwaukee's Historic Third Ward. They focus on apartment complexes, town homes, single-family homes, and commercial investment properties. Structure Properties offers services such as p ...Read More",4148828777,https://www.structure-properties.com/,https://www.propertymanagement.com/wp-content/uploads/2022/05/Structure-Properties.jpg,Milwaukee,Wisconsin
Trike Property Management,"1534 N Humboldt Avenue, Milwaukee, WI 53202","Trike Property Management is a real estate investments and management service handling multifamily apartment buildings, offices (including medical offices), industrial, and retail. Their website allows prospective tenants to search for apartments as well ...Read More",4143325500,https://trikepm.com/,https://www.propertymanagement.com/wp-content/uploads/2022/05/Trike-Property-Management.jpg,Milwaukee,Wisconsin
"Welcome Home Milwaukee, LLC","7311 W Greenfield Avenue, Milwaukee, WI 53214","Welcome Home Milwaukee assists investors by handling acquisitions, renovations, leasing, managing, and maintaining properties. Their best package is $136 combining the monthly fee, placement fee, move out fee, renewal fee, and maintenance. For easy conta ...Read More",4147971819,https://whmilwaukee.com/,https://www.propertymanagement.com/wp-content/uploads/2022/05/Welcome-Home-Milwaukee-LLC.jpg,Milwaukee,Wisconsin
Wilkins Property Management,"1020 E Pleasant Street, Milwaukee, WI 53202","Wilkins Property Management has more than 10 years of experience helping Milwaukee citizens find the right apartment home. Tenants must have an average gross monthly income of three times the rent amount, have a good credit score, and have not had an evi ...Read More",4142247570,https://www.wilkinsprop.com/,https://www.propertymanagement.com/wp-content/uploads/2022/05/Wilkins-Property-Management.jpg,Milwaukee,Wisconsin
Zolper Property Management,"3477 North Oakland Avenue, Milwaukee, WI 53211","Zolper Property Management's motto is ""Making Milwaukee home since 1996"". Their website homepage shows a helpful map of available apartment listings in the Greater Milwaukee area. Prospective tenants can find an open house or submit an application online ...Read More",4149628030,https://zolperproperties.com/,https://www.propertymanagement.com/wp-content/uploads/2022/05/Zolper-Property-Management.jpg,Milwaukee,Wisconsin
