name,address,description,phone,website,image,city,state
"Diamond Property Management, LLC","300 N Corporate Dr, Suite 280, Brookfield, WI 53045",Diamond Property Management delivers asset management services to tenants and building owners in the Bayside area. Customers can walk in or call any time from 9:00 a.m. to 4:00 p.m. Monday through Friday to access available services. The professionals ve ...Read More,2624399959,http://www.rentwithdiamond.com/,https://www.propertymanagement.com/wp-content/uploads/2022/08/Diamond-Property-Management-LLC.png,Bayside,Wisconsin
Insigne Real Estate Company LLC,"506 E Center St, Milwaukee, WI 53212","Insigne Real Estate Company has provided management solutions to owners of multifamily, commercial, single-family, and duplex buildings for more than 20 years. Customers can access services from 9:00 a.m. to 5:00 p.m. from Monday to Friday. The staff use ...Read More",4146778100,http://www.insigneproperties.com/,https://www.propertymanagement.com/wp-content/uploads/2022/08/Insigne-Real-Estate-Company-LLC.png,Bayside,Wisconsin
Karademas Management,"4532 N Wilson Dr, Shorewood, WI 53211","In business for more than 20 years, Karademas Management is an owner-managed real estate company offering property management solutions to residential building owners. It has property listings on its website to help owners find tenants for vacant units. ...Read More",4143835077,http://www.karademas.com/,https://www.propertymanagement.com/wp-content/uploads/2022/08/Karademas-Management.png,Bayside,Wisconsin
"Katz Properties, Inc.","614 W Brown Deer Rd, Suite 300, Bayside, WI 53217","Katz Properties has served the residential and commercial property needs of Bayside-area property owners for the last 35 years. The management team helps owners market their one-, two-, three-, or four-bedroom apartments. It offers same-day maintenance a ...Read More",4143328080,https://katzprop.com/,https://www.propertymanagement.com/wp-content/uploads/2022/08/Katz-Properties-Inc..png,Bayside,Wisconsin
Keren Properties,"5135 N Hollywood Ave, Milwaukee, WI 53217","For more than 30 years, family-owned Keren Properties has offered commercial and residential property management solutions for property owners in Milwaukee and the surrounding region. Tenants can conveniently submit maintenance requests via the website. ...Read More",4143321105,http://www.kerenpropertiesmke.com/,https://www.propertymanagement.com/wp-content/uploads/2022/08/Keren-Properties.png,Bayside,Wisconsin
"MPI Property Management, LLC","6700 W Fairview Ave, Milwaukee, WI 53213","Founded in 1978, MPI Property Management manages over 1100 residential units in Bayside and the surrounding areas. Its staff controls operations of condominiums, single-family homes, duplexes, and larger complexes. It provides customized services to meet ...Read More",4149332700,https://www.mpiwi.com/,https://www.propertymanagement.com/wp-content/uploads/2022/08/MPI-Property-Management-LLC.png,Bayside,Wisconsin
Neufeld Rentals,"2050 Good Hope Rd, Milwaukee, WI 53209",Neufeld Rentals is a locally-owned and operated business that has delivered property management solutions to Milwaukee-area property owners for over 50 years. It has a marketing platform on its website for vacant rentals. Interested individuals can use i ...Read More,4143582700,http://neufeldrentals.com/,https://www.propertymanagement.com/wp-content/uploads/2022/08/Neufeld-Rentals.png,Bayside,Wisconsin
Pennybag Property Management,"3728 N 36th St, Milwaukee, WI 53216","Pennybag Property Management provides commercial and residential property management solutions to Milwaukee metro-area property owners. It offers buildout services, including constructing room partitions to fit commercial tenants' needs. Additional manag ...Read More",2627191332,http://pennybagpropertymanagement.com/,https://www.propertymanagement.com/wp-content/uploads/2022/08/Pennybag-Property-Management.png,Bayside,Wisconsin
Performance Asset Management,"2658 S Kinnickinnic Ave, Milwaukee, WI 53207",Performance Asset Management provides residential property management services in Milwaukee. The marketing team advertises vacant units on more than 30 online platforms. It also shows properties to prequalified prospects and offers renter screenings thro ...Read More,4149431038,https://pammke.com/,https://www.propertymanagement.com/wp-content/uploads/2022/08/Performance-Asset-Management.png,Bayside,Wisconsin
PMI of Greater Milwaukee,"2665 S Moorland Rd, Suite 209, New Berlin, WI 53151","For more than 20 years, locally owned PMI of Greater Milwaukee has delivered asset management solutions to residential and commercial property owners in the greater Milwaukee area. The management team handles townhouses, single-family homes, condos, and ...Read More",4144339107,https://www.propertymanagementinc.com/pmi-greater-milwaukee/,https://www.propertymanagement.com/wp-content/uploads/2022/08/PMI-of-Greater-Milwaukee.png,Bayside,Wisconsin
RENU Property Management,"11617 W Bluemound Rd, Suite 4, Wauwatosa, WI 53226","RENU Property Management is a full-service company that helps investors manage their rental property portfolio. The asset managers market vacant units and vet prospective tenants. Also, they collect rent dues, send violation notices to renters, and evict ...Read More",4142552255,http://www.wisconsinpm.com/,https://www.propertymanagement.com/wp-content/uploads/2022/08/RENU-Property-Management.png,Bayside,Wisconsin
Residential Renters,"1345 N Jefferson St, #154, Milwaukee, WI 53202","Most recognized for their best-in-class tenant placement, Residential Renters serves landlords throughout the Greater Milwaukee Area. In addition to qualified tenant placement, they provide local agent representation, on-demand showings, renewal solution ...Read More",4144055363,http://www.residentialrenters.com/,https://www.propertymanagement.com/wp-content/uploads/2022/08/Residential-Renters.png,Bayside,Wisconsin
Schulhof Property Management LLC,"825 N 16th St, Milwaukee, WI 53233",Schulhof Property Management provides management solutions for more than 25 rental apartment properties in the Bayside area. The enrollment team directs interested customers to locate the website's online tenant application and lease forms and follow the ...Read More,4149331211,http://schulhofproperties.com/,https://www.propertymanagement.com/wp-content/uploads/2022/08/Schulhof-Property-Management-LLC.png,Bayside,Wisconsin
"Select Property Group, LLC","3555A N Oakland Ave, Shorewood, WI 53211","With over 25 years in the property management business, Select Property Group serves owners of apartments and homes in the metro Milwaukee area. It features an online portal that allows customers to pay rent, communicate with the management, and submit m ...Read More",4147275485,http://selectapartments.us/,https://www.propertymanagement.com/wp-content/uploads/2022/08/Select-Property-Group-LLC.png,Bayside,Wisconsin
Structure Properties,"225 E St. Paul Ave, Suite 302, Milwaukee, WI 53202","Structure Properties provides property management solutions for multiple buildings, including commercial investments, apartments, townhomes, and single-family homes. Its professionals offer tenant screening and property maintenance services and evict def ...Read More",4148828777,http://www.structure-properties.com/,https://www.propertymanagement.com/wp-content/uploads/2022/08/Structure-Properties.png,Bayside,Wisconsin
Welcome Home Milwaukee,"7311 W Greenfield Ave, Milwaukee, WI 53214","Founded in 2014, Welcome Home Milwaukee provides investment and property management solutions to Milwaukee property owners. Its accounting team ensures property owners receive timely monthly rent rolls, creates and oversees move-in and -out schedules, an ...Read More",4147971819,http://whmilwaukee.com/,https://www.propertymanagement.com/wp-content/uploads/2022/08/Welcome-Home-Milwaukee.png,Bayside,Wisconsin
World Property Management,"6330 W Lincoln Ave, West Allis, WI 53219","World Property Management is a full-service asset management company serving owners and residents of multifamily buildings, residential investment homes, and commercial properties. Its professionals advertise vacant units and run background checks on pro ...Read More",4145394199,https://www.worldpropertymgmt.com/,https://www.propertymanagement.com/wp-content/uploads/2022/08/World-Property-Management.png,Bayside,Wisconsin
"Apex Condominium Management, Inc.","1741 Commercial Avenue, Madison, WI 53704","Apex Condominium Management has been in business since 1986. A family-owned enterprise, Apex manages over 800 apartment homes and oversees over 300,000 square feet of commercial space. Its clients range from individual property investors to banks and tru ...Read More",6082553753,http://www.apexcondomanagement.com/,https://www.propertymanagement.com/wp-content/uploads/2022/04/Apex-Condominium-Management-Inc..png,Madison,Wisconsin
"Apex Property Management, Inc.","1741 Commercial Avenue, Madison, WI 53704","Apex Property Management has been in business since 1986. It provides prospective tenants with advanced search features, so they can find the ideal home with all the amenities they need. From one-bedroom apartments to four-bedroom homes, Apex offers a di ...Read More",6082553753,https://www.apexrents.com/,https://www.propertymanagement.com/wp-content/uploads/2022/04/Apex-Property-Management-Inc..png,Madison,Wisconsin
Avante Properties,"120 East Lakeside Street, Madison, WI 53715","Avante Properties manages luxury residential apartments, commercial properties, including retail and tech centers, and land lots. As Fitchburg's largest landowner and developer, the company offers a unique edge in the diversity of its offerings. Avante p ...Read More",6084419999,https://avanteproperties.com/,https://www.propertymanagement.com/wp-content/uploads/2022/04/Avante-Properties.png,Madison,Wisconsin
Birwood Property Management,"3165 E Washington Avenue, Madison, WI 53704","Birwood Property Management is committed to the highest standards in real estate management. The company helps property owners maximize their revenue and keep assets in excellent shape by offering marketing, management, and maintenance services. Birwood ...Read More",6082414449,https://www.birwood.net/,https://www.propertymanagement.com/wp-content/uploads/2022/04/Birwood-Property-Management.png,Madison,Wisconsin
"Broihahn Management & Consulting, LLC","1502 W Broadway, Suite #302, Madison, WI 53713","Broihahn Management & Consulting specializes in renting residential properties and offers services for both renters and owners. Sue Broihahn, the owner, and her team of professionals service nearly 1,000 properties in Dane and Rock counties. Broihahn ful ...Read More",6082221981,https://www.bmcmadison.com/,https://www.propertymanagement.com/wp-content/uploads/2022/04/Broihahn-Management-_-Consulting-LLC.png,Madison,Wisconsin
Colonial Property Management,"1308 Spring Street, LL, Madison, WI 53715","Colonial Property Management oversees over 1,500 apartments throughout South Central Wisconsin. With over 30 years of experience, the company manages units ranging from high-rise apartments to studios to large houses. Colonial's emphasis is on comfort. I ...Read More",6082512715,https://cmanagement.net/,https://www.propertymanagement.com/wp-content/uploads/2022/04/Colonial-Property-Management.png,Madison,Wisconsin
"Dobson Property Management, LLC","208 E. Olin Avenue, #207, Madison, WI 53713",Dobson Property Management is a local real estate sales and property management firm that has been in business for 13 years. Dobson oversees residential and commercial buildings and condo associations in the Madison and Dane County areas. Its services in ...Read More,6082171547,http://www.grindstonemanagement.com/,https://www.propertymanagement.com/wp-content/uploads/2022/04/Dobson-Property-Management-LLC.png,Madison,Wisconsin
Faircrest Management,"1741 Commercial Avenue, Madison, WI 53704","Faircrest Management has been a mainstay in Madison's real estate market and is one of its oldest property management companies. It offers apartment finder, property management, and industrial property services, along with real estate investment advice. ...Read More",6082408840,http://www.faircrest.com/,https://www.propertymanagement.com/wp-content/uploads/2022/04/Faircrest-Management.png,Madison,Wisconsin
"Grindstone Management, LLC","1605 Monroe Street, Madison, WI 53711",Grindstone Management is a locally owned and operated property management company in Madison. It has been in business for over a decade and was recognized by Expertise as one of the best property managers in Madison. ...Read More,6085359773,http://www.grindstonemanagement.com/,https://www.propertymanagement.com/wp-content/uploads/2022/04/Grindstone-Management-LLC.png,Madison,Wisconsin
"JEK Property Management, LLC","1214 Ann Street, Madison, WI 53713","JEK Property Management is a locally owned and operated firm that provides renters with an accessible and secure system for finding their ideal apartments in Madison. JEK focuses on the safety and friendliness of its residential properties, which range f ...Read More",6082572787,http://jekproperties.com/,https://www.propertymanagement.com/wp-content/uploads/2022/04/JEK-Property-Management-LLC.png,Madison,Wisconsin
Kader Property Management,"5609 Medical Circle, Madison, WI 53719","Kader Property Management prides itself on high standards, excellent service, and an overall sense of safety and security for residents. It offers a convenient online portal to pay rent. ...Read More",6083357655,http://www.kaderproperties.com/,https://www.propertymanagement.com/wp-content/uploads/2022/04/Kader-Property-Management.png,Madison,Wisconsin
"Kane Property Management, LLC","525 Junction Road, Suite 6500, Madison, WI 53717","Kane Property Management is a technologically integrated, community-oriented firm that has served the Madison area for over 11 years. The company offers unique features, such as software and preventative maintenance tools for maximum efficiency and seaml ...Read More",6088430297,http://kaneproperty.net/,https://www.propertymanagement.com/wp-content/uploads/2022/04/Kane-Property-Management-LLC.png,Madison,Wisconsin
"Madison Property Management, Inc.","1202 Regent Street, Madison, WI 53715","Madison Property Management provides real estate investors, renters, and tenants of various kinds of properties the opportunity to find and lease their ideal home or commercial location. Committed to fairness and transparency, it offers comprehensive ser ...Read More",6082518777,https://www.madisonproperty.com/,https://www.propertymanagement.com/wp-content/uploads/2022/04/Madison-Property-Management-Inc..png,Madison,Wisconsin
Palisade Property Management,"725 E Johnson Street, Madison, WI 53703","Palisade Property Management is committed to sustainable property offerings for tenants. From downtown apartments to commercial properties on the eastside of Madison to top-notch student apartments, Palisade is a company with ideals and skilled employees ...Read More",6084424200,https://palisadeproperty.com/,https://www.propertymanagement.com/wp-content/uploads/2022/04/Palisade-Property-Management.png,Madison,Wisconsin
Progressive Property Management,"1148 Williamson Street, Madison, WI 53703","Progressive Property Management is a community-focused company offering comprehensive services for property owners. With an emphasis placed on efficiency, environmental friendliness, and cost-effective solutions, PPM offers tenant screening, tours and sh ...Read More",6084455224,http://ppm-madison.com/,https://www.propertymanagement.com/wp-content/uploads/2022/04/Progressive-Property-Management.png,Madison,Wisconsin
Real Property Management,"6441 Enterprise Lane, Suite 115, Madison, WI 53719","Real Property Management has been in business for 30 years. It offers a full slate of services, including comprehensive marketing and advertising, thorough tenant screening and selection, and lease execution. It also collects rent in a timely manner, ins ...Read More",6083101290,http://www.rpmgreatermadison.com/,https://www.propertymanagement.com/wp-content/uploads/2022/04/Real-Property-Management.png,Madison,Wisconsin
"Regency Property Management, Inc.","102 N Franklin Street, Madison, WI 53703","Regency Property Management has been in business since 1980. It stands out from other property management companies in its meticulous attention to detail and customer care. From top to bottom, Regency has established itself as a leader in firms of its ki ...Read More",6082513700,https://regencypm.com/,https://www.propertymanagement.com/wp-content/uploads/2022/04/Regency-Property-Management-Inc..png,Madison,Wisconsin
"Smith Management Co., LLC","20 N Blair Street, #105, Madison, WI 53703","Smith Management Co. has been a locally owned business in Madison for over 30 years. It manages 45 properties in various Madison neighborhoods, and it responds swiftly to accounting questions and maintenance requests by phone or online. In addition, the ...Read More",6082848483,https://www.smithmgt.com/,https://www.propertymanagement.com/wp-content/uploads/2022/04/Smith-Management-Co.-LLC.png,Madison,Wisconsin
"Wisconsin Management Company, Inc.","4801 Tradewinds Parkway, Madison, WI 53718",Wisconsin Management Company has been in business for over 40 years. It serves all of Wisconsin and Northern Illinois and offers affordable rates at market prices. One of its distinguishing features is providing senior living homes. WMC follows the lates ...Read More,6082582080,https://www.wisconsinmanagement.com/,https://www.propertymanagement.com/wp-content/uploads/2022/04/Wisconsin-Management-Company-Inc..png,Madison,Wisconsin
"ABC Management, Inc.","621 E. Pleasant Street, Milwaukee, WI 53202","ABC Management, Inc., founded in 1999, manages residential, commercial, and industrial properties. Their current portfolio includes over 700 units of multifamily real estate. ABC supports multifamily homes, office buildings, retail centers, industrial fa ...Read More",4142253100,http://abcmilwaukee.com/,https://www.propertymanagement.com/wp-content/uploads/2022/05/ABC-Management-Inc..jpg,Milwaukee,Wisconsin
"Bartsch Management, LLC","225 E Mason Street, #500, Milwaukee, WI 53202","Bartsch Management specializes in managing and selling single-family, duplex, and multifamily properties throughout Metro Milwaukee. They are an equal housing opportunity company, and their property management services include leasing, rent collection, o ...Read More",4147637160,https://bartschmanagement.com/,https://www.propertymanagement.com/wp-content/uploads/2022/05/Bartsch-Management-LLC.jpg,Milwaukee,Wisconsin
"Bell Property Management, Inc.","2545 North Maryland Avenue, #102, Milwaukee, WI 53203","Bell Property Management, Inc., has buildings in multiple locations including the Eastside and Downtown Milwaukee. With other more suburban locations in New Berlin, Waukesha, and Hales Corners, there is something for everyone. The on-site property manage ...Read More",4143321117,https://www.bellapt.com/,https://www.propertymanagement.com/wp-content/uploads/2022/05/Bell-Property-Management-Inc..jpg,Milwaukee,Wisconsin
"Bieck Management, Inc.","4080 N. Port Washington Road, Milwaukee, WI 53212","Bieck Management, Inc., has been a family-owned and operated firm serving Wisconsin since 1977. Their properties include residential, office, retail, commercial, and light industrial. A couple of their properties that stand out from competitors are condo ...Read More",414961?7400,https://bieckmanagement.com/,https://www.propertymanagement.com/wp-content/uploads/2022/05/Bieck-Management-Inc..jpg,Milwaukee,Wisconsin
Citywide Rentals,"8432 W Lisbon Avenue, Milwaukee, WI 53222","Citywide Rentals and Property Management can help landlords with competitive rental rate setting, effective vacancy advertising, property showings, applicant screenings, lease signing and follow-through, property inspections, fee and rent collections, pr ...Read More",4142696446,https://citywiderentalsmke.com/,https://www.propertymanagement.com/wp-content/uploads/2022/05/city-wide-rentals.jpg,Milwaukee,Wisconsin
DAK Properties,"7448 N Teutonia Avenue, Milwaukee, WI 53209","DAK Properties prides itself on owning and operating all of its properties and having in-house management. They service Milwaukee and areas such as Riverwest, Grafton, Thiensville, Germantown, Jackson, and Menomonee Falls. Being in business for over 25 y ...Read More",4143511232,https://www.dakprop.com/,https://www.propertymanagement.com/wp-content/uploads/2022/05/DAK-Properties.jpg,Milwaukee,Wisconsin
Jomela Properties,"5601 W North Avenue, Milwaukee, WI 53208","Jomela is a locally owned business with affordable rental housing for apartments, duplexes, and single-family homes. Their website hosts an owner portal and a tenant portal, along with a link to pay rent online and submit a maintenance request. For tenan ...Read More",4144421700,https://www.jomela.com/,https://www.propertymanagement.com/wp-content/uploads/2022/05/Jomela-Properties.jpg,Milwaukee,Wisconsin
MPI Property Management LLC,"6700 W. Fairview Avenue, Milwaukee, WI 53213","MPI Property Management LLC has been serving Milwaukee and Waukesha since 1978. In addition to property management, MPI assists landlords with eviction services when required. As a State of Wisconsin licensed home improvement contractor, maintenance staf ...Read More",4149332700,https://www.mpiwi.com/,https://www.propertymanagement.com/wp-content/uploads/2022/05/MPI-Property-Management-LLC.jpg,Milwaukee,Wisconsin
"Northland Management, LLC","2720 N Frederick Ave, Milwaukee, WI 53211","Northland Management has provided property management services to Milwaukee-area property owners for more than 50 years. Customers can submit repair requests and pay rent from any location, courtesy of the online tenant portal. The company offers on-site ...Read More",4149629775,http://northlandmgt.com/,https://www.propertymanagement.com/wp-content/uploads/2022/08/Northland-Management-LLC.png,Milwaukee,Wisconsin
"Ogden & Company, Inc.","1665 N. Water Street, Milwaukee, WI 53202","Ogden & Company, Inc., has been operable in Milwaukee since 1929. They are the biggest full-service company in Wisconsin with about 200 employees in property management, brokerage, development, consulting, construction, and maintenance services. Their we ...Read More",4142765285,https://ogdenre.com/,https://www.propertymanagement.com/wp-content/uploads/2022/05/Ogden-_-Company-Inc..jpg,Milwaukee,Wisconsin
Optimum Property Management,"2120 W. Clybourn Street, Milwaukee, WI 53233","Optimum Property Management has been in business since the 1970s, managing properties on a fee basis. Residents can easily contact management, make a rent payment, or submit a maintenance request through the website. Interested tenants can request more i ...Read More",4143422120,https://www.rentfromoptimum.com/,https://www.propertymanagement.com/wp-content/uploads/2022/05/Optimum-Property-Management.jpg,Milwaukee,Wisconsin
Performance Asset Management,"2658 S Kinnickinnic Avenue, Milwaukee, WI 53207","Performance Asset Management is designed by investors for investors. They specialize in leasing, management, maintenance and renovations with no renewal fees, vacancy fees, or trip charges. The company is a member of the National Association of Residenti ...Read More",4149431038,https://pammke.com/,https://www.propertymanagement.com/wp-content/uploads/2022/05/Performance-Asset-Management.jpg,Milwaukee,Wisconsin
Porch Light Property Management & Real Estate,"6650 W State Street, Suite D221, Milwaukee, WI 53213","Porch Light Property Management & Real Estate is an equal opportunity housing provider managing apartments, town homes, and duplexes. Their website allows access to Flex Deposit, as well as an online rental application or cosigner application. Listings a ...Read More",4146781088,http://www.liveherelivehappy.com/,https://www.propertymanagement.com/wp-content/uploads/2022/05/Porch-Light-Property-Management-_-Real-Estate.jpg,Milwaukee,Wisconsin
Prospect Management LLC,"224 N. 76th Street, Milwaukee, WI 53213","Prospect Management LLC serves Milwaukee, Madison, and Kenosha with condominium and homeowner association management. In business since 1999, they are one of the few companies in Wisconsin to specialize in these areas. For prospective clients to contact ...Read More",4145400004,https://www.pmcwi.com/,https://www.propertymanagement.com/wp-content/uploads/2022/05/Prospect-Management-LLC.jpg,Milwaukee,Wisconsin
Rent Me WI,"4735 W National Avenue, Milwaukee, WI 53045","Rent Me WI assists investors with their real estate portfolios. Their services include rental property, acquisition, rehab/turnover, marketing, tenant screening, 24/7 maintenance, home inspections, and evictions and collections. Not only does Rent Me WI ...Read More",4142553806,https://www.rentmewi.com/,https://www.propertymanagement.com/wp-content/uploads/2022/05/Rent-Me-WI.jpg,Milwaukee,Wisconsin
Residential Renters,"1345 N. Jefferson St. #154, Milwaukee, Wisconsin 53202","Most recognized for their best-in-class tenant placement, Residential Renters serves landlords throughout the Greater Milwaukee Area. In addition to qualified tenant placement, they provide local agent representation, on-demand showings, renewal solution ...Read More",4144055363,https://residentialrenters.com/,https://www.propertymanagement.com/wp-content/uploads/2022/08/Residential-Renters.png,Milwaukee,Wisconsin
